{
  "schema_version": "b2b-respondent-portal-request-v0",
  "request_class": "preflight_only",
  "objective_item": 10,
  "surface": "b2b_respondent_portal",
  "status": "blocked",
  "source_public_candidate": {
    "domain": "public_experience_candidate",
    "candidate_digest": "sha256:aaaaaaaaaaaaaaaaaaaaaaaaaaaaaaaaaaaaaaaaaaaaaaaaaaaaaaaaaaaaaaaa",
    "payload_digest": "sha256:bbbbbbbbbbbbbbbbbbbbbbbbbbbbbbbbbbbbbbbbbbbbbbbbbbbbbbbbbbbbbbbb",
    "public_serving_enabled": false
  },
  "respondent_scope": {
    "entity_type": "company",
    "entity_public_name": "Example Company",
    "identity_verification_status": "not_verified_preflight",
    "contact_channel_available": false
  },
  "response_draft": {
    "draft_digest": "sha256:cccccccccccccccccccccccccccccccccccccccccccccccccccccccccccccccc",
    "draft_kind": "redacted_response_outline",
    "contains_raw_source": false,
    "contains_submitter_identity": false,
    "contains_device_or_network_signal": false,
    "contains_protected_fingerprint": false,
    "contains_reidentification_hint": false,
    "response_available": false
  },
  "required_gates": [
    "ED-005",
    "NO_DISCLOSURE_NEGATIVE_TESTS",
    "RESPONDENT_POLICY",
    "MODERATION_WORKFLOW"
  ],
  "blocked_until": [
    "ED-005",
    "NO_DISCLOSURE_NEGATIVE_TESTS",
    "RESPONDENT_POLICY",
    "MODERATION_WORKFLOW"
  ],
  "output_contract": {
    "requested_outputs": [
      "redacted_public_candidate_summary",
      "redacted_response_outline",
      "subject_public_name",
      "claim_type"
    ],
    "withheld_outputs": [
      "submitter_identity",
      "raw_source_material",
      "device_or_network_signal",
      "reidentification_hint",
      "protected_fingerprint",
      "raw_review_body",
      "source_metadata",
      "raw_moderation_evidence",
      "escrow_ciphertext",
      "escrow_handle",
      "escrow_key_material",
      "reviewer_private_note",
      "non_public_operational_detail",
      "respondent_visible_user_attribution"
    ]
  },
  "respondent_visibility_contract": {
    "visibility_state": "not_available_preflight",
    "visible_fields": [
      "subject_public_name",
      "redacted_public_candidate_summary",
      "claim_type",
      "redacted_response_outline"
    ],
    "withheld_fields": [
      "submitter_identity",
      "raw_source_material",
      "device_or_network_signal",
      "reidentification_hint",
      "protected_fingerprint",
      "raw_review_body",
      "source_metadata",
      "raw_moderation_evidence",
      "escrow_ciphertext",
      "escrow_handle",
      "escrow_key_material",
      "reviewer_private_note",
      "non_public_operational_detail",
      "respondent_visible_user_attribution"
    ],
    "identity_disclosure": "none",
    "raw_detail_disclosure": "none",
    "moderation_disclosure": "policy_status_only",
    "response_submission_policy": "disabled_until_gates_pass"
  },
  "portal_view_contract": {
    "view_model_kind": "redacted_respondent_preview",
    "view_model_state": "model_only_not_served",
    "route_allocation": "none",
    "access_token_issued": false,
    "server_render_enabled": false,
    "contains_submit_control": false,
    "contains_contact_channel": false
  },
  "respondent_action_contract": {
    "allowed_actions": [],
    "disabled_actions": [
      "submit_response",
      "upload_raw_detail",
      "request_submitter_identity",
      "message_submitter",
      "claim_business_profile",
      "open_dashboard"
    ],
    "action_token_issued": false
  },
  "surface_enablement": {
    "portal_enabled": false,
    "b2b_delivery_enabled": false,
    "response_submission_enabled": false,
    "public_serving_enabled": false,
    "identity_processing_enabled": false,
    "raw_detail_escrow_enabled": false,
    "dashboard_enabled": false
  },
  "forbidden_outputs": [
    "submitter_identity",
    "raw_source_material",
    "device_or_network_signal",
    "reidentification_hint",
    "protected_fingerprint",
    "raw_review_body",
    "source_metadata",
    "raw_moderation_evidence",
    "escrow_ciphertext",
    "escrow_handle",
    "escrow_key_material",
    "reviewer_private_note",
    "non_public_operational_detail",
    "respondent_visible_user_attribution"
  ],
  "result_contract": {
    "command_effect": "preflight_only",
    "opens_portal": false,
    "delivers_to_b2b": false,
    "makes_response_available": false,
    "opens_public_surface": false,
    "serves_dashboard": false,
    "performs_identity_processing": false,
    "stores_raw_detail": false
  }
}
